{
  "openbrick": "1.0",
  "kind": "process",
  "id": "resin-msla",
  "credit": { "author": "OpenBrick3D contributors" },
  "name": "MSLA resin, tough or ABS-like resin only (experimental)",
  "experimental": true,
  "lineWidthMm": 0.05,
  "layerHeightMm": [0.05],
  "minWallMm": 1.0,
  "wallQuantiseMm": 0.05,
  "minFeatureMm": 0.3,
  "minTubeWallMm": 0.7,
  "minCavityDepthMm": 1.8,
  "minReliefHeightMm": 0.2,
  "maxReliefHeightMm": 1.5,
  "minRoofMm": 1.0,
  "maxUnsupportedBridgeMm": 20,
  "maxOverhangDeg": 60,
  "firstLayerChamferMm": 0.0,
  "studTopChamferMm": 0.2,
  "wallRoofFilletMm": { "brick": 1.0, "plate": 0.3 },
  "supportsAllowed": true,
  "horizontalHoleStrategy": "ellipse",
  "tessellation": { "studSegments": 96, "minEdgeMm": 0.03 },
  "notes": "Global scale about 1.009 to 1.011; no clutch dataset yet; standard resin is too brittle."
}
